{
  "schema_version": "1.0.0",
  "handshake_id": "fhsk-20260901T172500000Z-a1b2c3d4",
  "local_peer_id": "peer-0000000000000001",
  "remote_peer_id": "peer-a1b2c3d4e5f60718",
  "nonce": "e3b0c44298fc1c149afbf4c8996fb92427ae41e4649b934ca495991b7852b855",
  "supported_exchange_types": [
    "METADATA_SYNC",
    "CAPABILITY_QUERY",
    "OCI_BUNDLE_EXCHANGE",
    "LOCKFILE_VALIDATION"
  ],
  "handshake_status": "ESTABLISHED",
  "handshake_utc": "2026-09-01T17:25:00Z"
}
